{
  "$schema": "https://json-schema.org/draft/2020-12/schema",
  "$id": "https://yeetcraft.dev/contracts/companion/v1/schema/ingest-batch-request.schema.json",
  "$comment": "Status: Draft — reviewed, not implemented",
  "title": "Companion ingest batch request v1",
  "type": "object",
  "additionalProperties": false,
  "required": ["schemaVersion", "batchId", "events"],
  "properties": {
    "schemaVersion": {
      "type": "integer",
      "const": 1
    },
    "batchId": {
      "$ref": "#/$defs/uuid"
    },
    "installationId": {
      "$ref": "#/$defs/uuid"
    },
    "events": {
      "type": "array",
      "minItems": 1,
      "maxItems": 500,
      "items": {
        "$ref": "#/$defs/deathEvent"
      }
    }
  },
  "$defs": {
    "uuid": {
      "type": "string",
      "pattern": "^[0-9a-f]{8}-[0-9a-f]{4}-[0-9a-f]{4}-[0-9a-f]{4}-[0-9a-f]{12}$"
    },
    "sha256Digest": {
      "type": "string",
      "pattern": "^sha256:[0-9a-f]{64}$"
    },
    "playerGuid": {
      "type": "string",
      "pattern": "^Player-[0-9A-Za-z]+-[0-9A-Za-z]+$"
    },
    "canonicalInstant": {
      "type": "string",
      "pattern": "^\\d{4}-\\d{2}-\\d{2}T\\d{2}:\\d{2}:\\d{2}\\.\\d{9}Z$"
    },
    "run": {
      "type": "object",
      "additionalProperties": false,
      "required": [
        "clientRunId",
        "challengeModeStartInstant",
        "challengeMapId",
        "keystoneLevel"
      ],
      "properties": {
        "clientRunId": {
          "$ref": "#/$defs/sha256Digest"
        },
        "challengeModeStartInstant": {
          "$ref": "#/$defs/canonicalInstant"
        },
        "challengeMapId": {
          "type": "integer",
          "minimum": 1
        },
        "keystoneLevel": {
          "type": "integer",
          "minimum": 0
        },
        "seasonId": {
          "$ref": "#/$defs/uuid"
        }
      }
    },
    "encounter": {
      "type": "object",
      "additionalProperties": false,
      "required": ["encounterId"],
      "properties": {
        "encounterId": {
          "type": "integer",
          "minimum": 1
        }
      }
    },
    "cause": {
      "type": "object",
      "additionalProperties": false,
      "required": ["rank", "sourceType", "amount", "overkill", "confidence"],
      "properties": {
        "rank": {
          "type": "integer",
          "minimum": 1,
          "maximum": 3
        },
        "sourceType": {
          "type": "string",
          "enum": ["spell", "range", "melee", "environmental"]
        },
        "spellId": {
          "type": "integer",
          "minimum": 1
        },
        "creatureId": {
          "type": "integer",
          "minimum": 1
        },
        "environmentalType": {
          "type": "string",
          "minLength": 1,
          "maxLength": 64
        },
        "amount": {
          "type": "integer",
          "minimum": 0
        },
        "overkill": {
          "type": "integer",
          "minimum": 0
        },
        "confidence": {
          "type": "string",
          "enum": ["high", "medium", "low"]
        }
      },
      "allOf": [
        {
          "if": {
            "properties": {
              "sourceType": {
                "enum": ["spell", "range"]
              }
            },
            "required": ["sourceType"]
          },
          "then": {
            "required": ["spellId"]
          }
        },
        {
          "if": {
            "properties": {
              "sourceType": {
                "const": "environmental"
              }
            },
            "required": ["sourceType"]
          },
          "then": {
            "required": ["environmentalType"]
          }
        }
      ]
    },
    "deathEvent": {
      "type": "object",
      "additionalProperties": false,
      "required": [
        "clientEventId",
        "characterGuid",
        "deathInstant",
        "ordinal",
        "run",
        "encounter"
      ],
      "properties": {
        "clientEventId": {
          "$ref": "#/$defs/sha256Digest"
        },
        "characterGuid": {
          "$ref": "#/$defs/playerGuid"
        },
        "deathInstant": {
          "$ref": "#/$defs/canonicalInstant"
        },
        "ordinal": {
          "type": "integer",
          "minimum": 0
        },
        "category": {
          "type": "string",
          "const": "death"
        },
        "run": {
          "$ref": "#/$defs/run"
        },
        "encounter": {
          "oneOf": [
            {
              "type": "null"
            },
            {
              "$ref": "#/$defs/encounter"
            }
          ]
        },
        "causes": {
          "type": "array",
          "maxItems": 3,
          "items": {
            "$ref": "#/$defs/cause"
          }
        }
      }
    }
  }
}
