{
  "schemaVersion": 1,
  "batchId": "a1000001-0001-4000-8000-000000000002",
  "installationId": "b2000002-0002-4000-8000-000000000002",
  "events": [
    {
      "clientEventId": "sha256:0df4a56b8cc57753750a3215224cb88eae7d54951465c07e6b2b19827e1d8dc0",
      "characterGuid": "Player-0001-00000001",
      "category": "death",
      "deathInstant": "2026-02-10T18:52:00.000000000Z",
      "ordinal": 0,
      "run": {
        "clientRunId": "sha256:8de6d05a987d9230788f5a56957a80c8608335bbc509ca5fac1a1bf17336b30d",
        "challengeModeStartInstant": "2026-02-10T18:30:00.000000000Z",
        "challengeMapId": 375,
        "keystoneLevel": 12,
        "seasonId": "c3000003-0003-4000-8000-000000000003"
      },
      "encounter": {
        "encounterId": 2901
      },
      "causes": [
        {
          "rank": 1,
          "sourceType": "spell",
          "spellId": 320596,
          "creatureId": 165408,
          "amount": 125430,
          "overkill": 8420,
          "confidence": "high"
        },
        {
          "rank": 2,
          "sourceType": "range",
          "spellId": 320784,
          "creatureId": 165408,
          "amount": 31820,
          "overkill": 0,
          "confidence": "medium"
        }
      ]
    }
  ]
}
